<?xml version="1.0"?>
<tableObjectMapping xmlns="http://www.exceltoobject4j.myamoto.com/tableObjectMapping"
	xmlns:xsi="http://www.w3.org/2001/XMLSchema-instance"
	xsi:schemaLocation="http://www.exceltoobject4j.myamoto.com/tableObjectMapping ../../../src/main/resources/tableimporterconfig.xsd">
	
	<typeMapper className="com.myamoto.exceltoobject4j.data.Pont">
		<fieldMapper name="id" identificator="true" />
		<fieldMapper name="name" />
		<fieldMapper name="pileList" />
	</typeMapper>
	<typeMapper className="com.myamoto.exceltoobject4j.data.Pile">
		<fieldMapper name="id" identificator="true" />
		<fieldMapper name="name" />
		<fieldMapper name="type" />
	</typeMapper>
	<typeMapper className="com.myamoto.exceltoobject4j.data.TypePile">
		<fieldMapper name="nom" identificator="true" />
	</typeMapper>
</tableObjectMapping>